pack_id,yaml_path,brand_layer_dir,knowledge_assertion_excerpt,granularity_layer,consumption_purpose,production_tier,default_call_pool,resource_baseline_default,production_difficulty,resource_baseline,hook,steps,anti_pattern,duration,audience,review_notes
KP-service_judgment-product-review-concerns-clearance-on-spot,candidates/domain_general/KP-service_judgment-product-review-concerns-clearance-on-spot.yaml,domain_general,"product_review 内容里，""只拍犹豫 / 不拍优点 / 顾虑解除测评""在 **接客现场**有专属用法：店员站在店内顾客旁边，针对顾客当场说出的""我怕 X"" （怕透 / 怕勒 / 怕扎 / 怕显胯 / 怕短 / 怕显壮 / 怕难搭）， 拿出同款现场做 30 秒以内 3 个具体测试（窗边逆光看透 / 侧身镜前看胯 / 手臂贴脸颊看扎），测试通过后留一句""如果你和我怕的是同几件事，这件可以进",L2,generation,instant,true,1人+手机+200元+4h,medium,,把顾客当场说出的顾虑变成三十秒可见测试,复述顾客最怕的一点;拿同款做三个现场测试;用一句条件式裁决收口,只说不透不勒不显胯却不给任何现场证据,short,正在店里犹豫下单的顾客,W12.A 人工审表确认
KP-service_judgment-product-review-tactile-court-three-piece-compare,candidates/domain_general/KP-service_judgment-product-review-tactile-court-three-piece-compare.yaml,domain_general,"product_review 内容里，""触感法庭 / 同类三件对照声音证据""在**接客现场** 是店内最强转化工具——当两个犹豫的客人选两件相似品时，店员把同类三件 （同为白 T / 同为卫衣 / 同为西装裤）摆桌面俯拍，几乎不说话， 只用衣料摩擦 / 拉伸 / 扣子碰撞 / 拉链""咔哒""声做三段测试 （回弹 / 抬手 / 贴麦声音），最后给一句裁决（""如果你讨厌起球，今天只选 2 号""）。 调用",L2,generation,instant,true,1人+手机+200元+4h,medium,,用三件同类衣服的声音和触感做一场法庭裁决,同类三件摆到同一桌面;依次拍摩擦拉伸扣件声音;最后给出只选几号的裁决,导购一直口播面料好坏而没有同框对照证据,short,在相似款之间犹豫的顾客,W12.A 人工审表确认
KP-styling_rule-behind-scenes-invisible-completion-cost,candidates/domain_general/KP-styling_rule-behind-scenes-invisible-completion-cost.yaml,domain_general,"behind_the_scenes 内容里，""看不见的完成成本""应该用""非 glamorous 劳动""格式拍—— 谁在熨衣服 / 谁在捡地上的胶带 / 谁在搬箱子 / 谁在重新别吊牌 / 谁在把试衣间弄干净 / 谁在拍摄结束后把衣服一件件装回袋子。真正有效的 BTS 不是更漂亮，而是更接近""现实中的完成成本""。 观众把""看不见的劳动""看见后，会自然把品牌从""logo""还原成""认真的人""，建立尊重而",L2,generation,instant,true,1人+手机+200元+4h,low,,让观众看见漂亮成片背后那些没人拍的完成成本,连续拍三个低位劳动瞬间;保留杂乱声音和手部动作;结尾落到认真完成的人,把幕后拍成精修花絮只展示漂亮和热闹,medium,关心品牌真实劳动的人群,W12.A 人工审表确认
KP-styling_rule-behind-scenes-parallel-split-screen,candidates/domain_general/KP-styling_rule-behind-scenes-parallel-split-screen.yaml,domain_general,"behind_the_scenes 内容里，""同一秒的两面 / 平行世界 BTS""应该用最朴素的左右分屏剪辑—— 左边放最终看起来很顺的那 1 秒（模特优雅转身 / 顾客在镜头里笑 / 补光柔美）， 右边放这 1 秒画面外发生了什么（有人蹲地拉裙摆 / 店员伸手接住快掉的展示牌 / 有人举手机当补光喊""左边一点""）。要点是""同步并置""而非""前后切换""—— 与 event_documentary C",L2,generation,instant,true,1人+手机+200元+4h,medium,,同一秒左右分屏揭开成片内外两个世界,选一秒最终顺滑画面;同步放入画面外救场动作;用并置而不是解释制造反差,前后流水账复盘花絮导致同步反差消失,short,喜欢看真实拍摄现场的观众,W12.A 人工审表确认
KP-styling_rule-behind-scenes-store-soundprint,candidates/domain_general/KP-styling_rule-behind-scenes-store-soundprint.yaml,domain_general,"behind_the_scenes 内容里，""店的声纹 / 10 个声音组成一条幕后""是一条 把服装门店声音密度（卷帘门 / 门铃 / 衣架 / 扫码 / 剪吊牌 / 熨烫蒸汽 / 纸袋摩擦 / 试衣间门 / 拉链 / 关灯）做成**品牌识别资产**的玩法—— 全片不靠画面热闹，只用 30 秒里 10 段近距收音的店内声音 + 极近景画面， 画面只服务于声音。本卡聚焦""**空间声纹**""，与 da",L2,generation,instant,true,1人+手机+200元+4h,medium,,用十个门店近距声音做出品牌空间声纹,收集门铃衣架蒸汽纸袋等声音;每个声音配一个极近景;按声音节奏剪成三十秒,只拍店里热闹画面却忽略可识别的声音细节,short,对门店氛围和质感敏感的观众,W12.A 人工审表确认
KP-styling_rule-daily-fragment-fixed-corner-time-fold,candidates/domain_general/KP-styling_rule-daily-fragment-fixed-corner-time-fold.yaml,domain_general,"daily_fragment 内容里，""同一个角落，不同的我""是一条用**单地点 + 时间褶皱** 反掉""碎片必须多地点多切换""套路的玩法——手机放在同一角度，连续 5-7 天 拍某个固定时刻（回家推门进来的 5 秒 / 店里开灯前的 10 秒 / 晚上脱鞋坐下的 6 秒）。 没有""大事""，但每天动作、穿着、包的摆放、表情、进门速度都不一样。 服装在此自然成为时间变化的证据：同一个人这几天为什么穿",L2,generation,instant,true,1人+手机+200元+4h,low,,同一个角落连续几天拍出人和衣服的时间变化,固定手机角度和固定时刻;每天只拍进门或开灯几秒;用穿着痕迹串起变化,每天换地点快剪导致碎片没有时间褶皱,medium,喜欢日常陪伴感内容的观众,W12.A 人工审表确认
KP-styling_rule-daily-fragment-no-face-traces,candidates/domain_general/KP-styling_rule-daily-fragment-no-face-traces.yaml,domain_general,"daily_fragment 内容里，""不拍脸 / 只拍生活留下的痕迹""是一条强力突破玩法—— 椅背上的外套 / 刚摘下的耳环 / 收银台边的一杯水 / 试衣间地上的纸袋 / 回家后放下的钥匙 / 洗过的衬衫在窗边滴水。观众不会觉得""信息不足""，反而更想靠近， 因为人是通过痕迹出现的。服装天然是最容易留下痕迹的物件——衣架空位 / 刚脱下的针织 / 试穿留下的褶皱都是很强的""服装性痕迹""。本卡打破",L2,generation,instant,true,1人+手机+200元+4h,low,,不露脸只拍生活留下的痕迹让人自然出现,选衣物钥匙水杯等生活痕迹;避开正脸只拍物件状态;用最后一个痕迹暗示人物情绪,为了信息完整强行露脸讲解破坏靠近感,short,喜欢安静生活碎片的人群,W12.A 人工审表确认
KP-styling_rule-daily-fragment-sensory-sort-not-time,candidates/domain_general/KP-styling_rule-daily-fragment-sensory-sort-not-time.yaml,domain_general,"daily_fragment 内容里，""碎片按体感排（不按时间）""是一条把碎片组织从 ""时间顺序""反掉成""感官分类""的玩法——从""今天最软的东西""开始（袖口 / 蒸汽 / 头发 / 傍晚光）， 接""今天最吵的东西""（拉链 / 地铁 / 店门 / 手机震动），最后落到""今天终于安静的那一秒""。 观众接住的是**体感**，而不是行程。布料本来就有触感和声音， 非常适合做体感排序——这是服装行业 dai",L2,generation,instant,true,1人+手机+200元+4h,medium,,把一天按软吵静这些体感排序而不是按时间排序,先拍今天最软的触感;再拍今天最吵的声音;最后落到终于安静的一秒,按早中晚流水账排列导致体感记忆变弱,medium,对触感声音和生活气味敏感的观众,W12.A 人工审表确认
KP-styling_rule-daily-fragment-single-chair-time-fold,candidates/domain_general/KP-styling_rule-daily-fragment-single-chair-time-fold.yaml,domain_general,"daily_fragment 内容里，""同一把椅子四次""是一条用**单地点 + 时段道具替身** 在 4 小时内拍完的""陪伴感""碎片玩法——手机固定拍一把椅子或店里的试衣凳， 早上椅子上是一件外套（出门）；中午是一杯喝到一半的咖啡（撑住）； 傍晚是一只购物袋（松一口气）；夜里是一盏小灯照着空椅子（回到自己）。 每次出现你都只露出手：把东西放下、停两秒、又拿走。 服装在此作为""情绪载体""出现（外套 ",L2,generation,long_term,true,2-3人+轻设备+1000元+1-2天,medium,,同一把椅子四次出现拍出一天的陪伴感,固定椅子机位分四个时段拍摄;每次只放下一件物品停两秒;结尾用空椅子收住情绪,把椅子当普通摆拍道具而没有时段变化,medium,喜欢慢节奏生活叙事的人群,W12.A 人工审表确认
KP-styling_rule-emotion-expression-clothes-as-emotion-vessel,candidates/domain_general/KP-styling_rule-emotion-expression-clothes-as-emotion-vessel.yaml,domain_general,"服装行业的情绪表达内容里，""一件衣服替我说完今天没说出口的话""是旗舰玩法—— 镜头从回家开始，主角一句话不说，只是把外套从肩上慢慢脱下来 / 搭在椅背上 / 过一会儿又拿起来抱在怀里坐着；背景只有电饭煲跳闸声 / 楼下车声 / 微信提示音但不看； 字幕极少，只在最后出现一行：""今天没有崩溃，只是一直没空掉下来。"" 这时那件衣服不是商品也不是穿搭，而是""今天所有没被接住的情绪容器""。 服装是情绪载体",L2,generation,instant,true,1人+手机+200元+4h,medium,,让一件衣服替主角说完今天没说出口的话,从回家沉默动作开始;用脱下抱起挂回衣服承载情绪;最后只留一行克制字幕,用大段口播解释情绪导致衣服失去承载力,medium,被日常情绪和服装记忆打动的人群,W12.A 人工审表确认
KP-styling_rule-old-sample-as-error-archive,candidates/domain_general/KP-styling_rule-old-sample-as-error-archive.yaml,domain_general,"服装行业 founder_ip 内容里""旧样衣 = 人格化错误档案""是一条独占叙事钩子—— 老板把一件被压在柜底的旧样衣（皱领口 / 失败版型 / 过时颜色）拿出来， 像审问旧证物一样指出""这里当时为什么错、那时我为什么会做这个决定、这件衣服暴露了我哪个阶段的幼稚""。 服装行业是唯一能做这种""判断证据链""内容的行业（其他行业没有具象的失败物件）， 所以 founder_ip 优先级别高于""决策日记",L2,generation,instant,true,1人+手机+200元+4h,medium,,把旧样衣当错误档案审问出创始人的成长证据,拿出一件失败旧样衣;指出三个当时的错误决策;收束到现在为什么不再这样做,只怀旧展示旧款而不说它暴露的判断错误,medium,关心创始人真实判断的人群,W12.A 人工审表确认
KP-styling_rule-ootd-clothes-remember-today,candidates/domain_general/KP-styling_rule-ootd-clothes-remember-today.yaml,domain_general,"outfit_of_the_day 内容里，""衣服记住了今天""是一条对服装品牌极有杀伤力的玩法—— 从拍""穿上它""改成拍""它怎么被今天留下痕迹""：早上平整的裤线 → 下午坐久后的褶皱； 刚出门时笔挺的衬衫 → 晚上领口松掉一点；包带在肩上压出的痕迹；牛仔裤膝盖处的弯曲。 最后把衣服挂起来，OOTD 才真正完整。它天然把""耐看 / 耐穿 / 会呼吸""这类隐性价值拍出来—— 比任何材质 / 工艺参数都",L2,generation,instant,true,1人+手机+200元+4h,low,,不拍刚穿上而拍衣服怎样记住今天的痕迹,拍早上平整的初始状态;拍途中褶皱压痕和松动;最后挂回去让一天闭合,只做镜前搭配展示没有留下任何生活痕迹,medium,想看真实穿着而非摆拍的人群,W12.A 人工审表确认
KP-styling_rule-ootd-micro-suspense-decision-chain,candidates/domain_general/KP-styling_rule-ootd-micro-suspense-decision-chain.yaml,domain_general,"outfit_of_the_day 内容里，""30 秒微悬疑""是把 OOTD 多次换装从""快剪秀"" 反向定义为""**有因果的真实换装决策链**""的玩法——开头 2 秒只露出袖口 上面有一粒小线头 + 字幕""今天我为什么换了三次衣服？""（不解释）。 手机震动 → 你换成第二套；店里镜前发现第二套会走光 → 换第三套。 全片**不说**""显瘦显高""，只让观众跟着你解决真实问题。 品牌卖点被转译为""**",L2,generation,instant,true,1人+手机+200元+4h,medium,,用三次换装的因果链制造三十秒微悬疑,开头露出一个小问题和悬念字幕;跟拍两次换装原因;第三套解决真实场景问题,把多次换装剪成显瘦快秀却没有决策因果,short,爱看真实选择过程的穿搭观众,W12.A 人工审表确认
KP-styling_rule-ootd-route-fitness-not-display,candidates/domain_general/KP-styling_rule-ootd-route-fitness-not-display.yaml,domain_general,"outfit_of_the_day 内容里，""这套衣服不是为了拍照，是为了今天的路线""是 把 OOTD 从""展示搭配""反向升级成""展示生活适配""的核心玩法—— 不是站镜前展示，而是跟着这套衣服走完整条真实路线： 早上骑车为什么外套要能挡风 / 进店为什么要能卷袖子 / 下午试衣时为什么鞋子不能太累 / 晚上和朋友见面为什么把头发放下后这套突然更松。 品牌卖点被转译为""挡得住风 / 收得起来 / 走",L2,generation,instant,true,1人+手机+200元+4h,medium,,让衣服跟完整路线走而不是站镜前被展示,列出今天真实路线节点;每个节点拍衣服解决的一个问题;用路线结束验证搭配成立,站在镜前讲搭配优点没有生活路线验证,medium,需要穿搭适配真实日程的人群,W12.A 人工审表确认
KP-styling_rule-process-trace-rejected-garment,candidates/domain_general/KP-styling_rule-process-trace-rejected-garment.yaml,domain_general,"process_trace 内容生产纪律：拍**那件被拦下来的衣服**比拍合格品更能建立信任—— ""认真不是把好的拿出来炫，而是把'不够好的'挡在外面""。 服装行业极适合用""被拒绝的成衣""做内容（一毫米偏差 / 平整度不够 / 洗后状态不稳）， 观众很少被允许看到这个环节，因此**用淘汰建立信任**比用展示流程更稀缺。 这是 process_trace 的""边界感证据""独占玩法——用品牌愿意挡掉什",L2,generation,instant,true,1人+手机+200元+4h,medium,,拍被拦下来的衣服比拍合格品更能建立信任,从一件看似正常的衣服开始;指出不能过的具体细节;放进返工或淘汰位置收口,只展示好品和严格口号却不展示被拒绝证据,short,重视品牌质量边界的顾客,W12.A 人工审表确认
KP-styling_rule-process-trace-single-hard-fake-step,candidates/domain_general/KP-styling_rule-process-trace-single-hard-fake-step.yaml,domain_general,"process_trace 内容生产纪律：不试图拍全流程，而只拍一个**最容易看出真假的节点**—— 服装行业最难伪装的步骤集中在""对花 / 缝线收口 / 面料回弹 / 整烫肩线 / QC 拦下""， 单点深拍比全流程更有说服力。""knowing is the new owning""——年轻观众着迷的不只是 ""知道在哪做""，而是""知道怎么做、为什么这样做""。这条规则推翻""工艺溯源必须拍全流程""的默认",L2,generation,instant,true,1人+手机+200元+4h,medium,,只深拍一个最难伪装的工艺节点让真实自己说话,选对花缝线整烫等单一节点;用近景拍判断标准;解释为什么这一点很难假装,试图拍完整流程导致每个步骤都浅而像宣传片,medium,想知道衣服到底怎么做的人群,W12.A 人工审表确认
KP-styling_rule-talent-showcase-micro-skill-hundred-reps,candidates/domain_general/KP-styling_rule-talent-showcase-micro-skill-hundred-reps.yaml,domain_general,"服装行业的才艺展示内容里，""丝巾系法 / 袖口卷法 / 衬衫下摆塞法 / 收腰 / 打结""等 ""微技能""应该用""练一百次的痕迹""格式拍——前几次都怪、最后一次刚刚好——而不是直接给成品。 观众接住的不是""哦你会""，而是""哦你练过""。该格式打破""才艺=结果""的套路， 改成""才艺=控制力""，让服装的微技能从默认默认的""穿搭技巧""升级为可被认领的能力证据。",L2,generation,instant,true,1人+手机+200元+4h,medium,,把微技能拍成练过一百次的控制力证据,先展示几次失败或别扭动作;保留重复练习痕迹;最后一次刚刚好完成,直接展示完美成品让才艺变成普通技巧炫耀,medium,喜欢学习穿搭微技能的观众,W12.A 人工审表确认
KP-training_unit-behind-scenes-near-disaster-narrative,candidates/domain_general/KP-training_unit-behind-scenes-near-disaster-narrative.yaml,domain_general,"behind_the_scenes 内容生产纪律：BTS 进阶档（C2-1）的""差点翻车 / 一条内容的诞生"" 必须用""**问题出现 → 临场调整 → 最终镜头**""三段式叙事弧，**而不是**""翻车流水账""。 错误做法：把 5 个翻车点平铺直叙都拍出来，每个 5 秒一笔带过，结尾收一句""今天好难""—— 观众接住的是""你们工作很乱""。正确做法：抓 1 个翻车点（光不对 / 模特迟到 / 拍到一半下",L2,generation,instant,true,1人+手机+200元+4h,medium,,用一个差点翻车点讲清内容如何被救回来,明确一个具体问题出现;拍临场调整动作;对照最终镜头说明救回结果,平铺五个翻车点让观众只觉得现场混乱,medium,喜欢看内容诞生过程的观众,W12.A 人工审表确认
KP-training_unit-enterprise-narrative-object-witness-over-talking-head,candidates/domain_general/KP-training_unit-enterprise-narrative-object-witness-over-talking-head.yaml,domain_general,"企业叙事类突破玩法的共性手法是""把具体物件做主角，让物件代替口播承担叙事""——旧样衣 / 别针 / 蒸汽熨斗 / 衣架 / 试衣间门帘 / 布料摩擦声 / 缝纫机声 / 边角料 / 失败样衣等""低位物件""先于人脸入镜，人物的判断和品牌气质通过对物件的反应自然显形。 这不是装饰手法，而是反 AI 腔的具体可执行抓手：物件越具体、越带劳动痕迹，AI 仿写成本越高，观众""真实完成感""越强。",L2,generation,instant,true,1人+手机+200元+4h,low,,让低位物件替代人脸口播承担企业叙事,先让旧样衣熨斗衣架等物件入镜;拍人对物件的具体反应;用物件痕迹收住品牌判断,人物正对镜头讲价值观导致内容像企业宣传,medium,讨厌空泛品牌口播的观众,W12.A 人工审表确认
KP-training_unit-error-first-then-correct-replay,candidates/domain_general/KP-training_unit-error-first-then-correct-replay.yaml,domain_general,"服装门店接客培训中，""错误先发生再倒回去重来""比""先讲正确答案""更接近真实上岗—— 让员工先看一段具体翻车（顾客问'会不会显胯' / 店员立刻回答'不会不会特别显瘦' / 顾客表情冷掉），画面定格 + 字幕""问题不是你说错 / 是你说太快""，然后倒带重演正确版本 （店员先反问'你平时更在意胯还是腿型' / 再根据回答推荐）。员工接住的不是""背话术"" 而是""判断顺序的重要性""——错误体验的记忆保持远",L2,generation,instant,true,1人+手机+200元+4h,medium,,先让接客错误发生再倒带重演正确判断顺序,拍一段具体翻车对话;定格标出错在太快回答;倒带重演先问再判断的版本,先讲正确答案让员工只背话术不记判断,medium,需要现场接客训练的门店员工,W12.A 人工审表确认
KP-training_unit-event-documentary-failure-perspective,candidates/domain_general/KP-training_unit-event-documentary-failure-perspective.yaml,domain_general,"event_documentary（事件纪实）允许且推崇""失败视角""作为 C3 突破性玩法之一——拍无人问津的展位 / 首日零订单的焦虑 / 布展翻车的瞬间 / 大促备货后卖不动的仓库。这违反主流""事件内容必拍光鲜场面""的套路，但能接住""这家品牌真的在扛过"" 的信任。服装行业是少数""敢展示失败就能赢信任""的行业之一——空展位 / 卖不动的尺码 / 退货堆积 / 布展翻车都极具 可视性。失败视角与 ",L2,generation,instant,true,1人+手机+200元+4h,medium,,敢从失败视角拍事件反而更能赢得信任,选择一个可见失败现场;拍焦虑和调整而不是粉饰;收束到品牌如何继续扛住,只拍光鲜热闹场面掩盖真实事件压力,medium,关心品牌真实经历的观众,W12.A 人工审表确认
KP-training_unit-event-documentary-long-term-tier-discipline,candidates/domain_general/KP-training_unit-event-documentary-long-term-tier-discipline.yaml,domain_general,"event_documentary（事件纪实）允许""长期型""（long_term）玩法分级——单条成片仍 ≤ 4 小时收敛，但素材采集 阶段允许跨日（典型 3 天 / 72 小时时间压缩）。这是企业叙事类继 talent_showcase C3-7（100 天挑战）之后第 2 个 使用""单条合规但素材采集跨天""策略的 CT。规则：单条内容剪辑成品必须收敛到 4 小时标准；素材跨日不视为违反 实拍可",L2,generation,instant,true,1人+手机+200元+4h,medium,,跨日采集但单条成片仍收敛在四小时标准内,提前定义三天素材采集节点;每天只拍一个关键证据;剪辑时压缩成单条清晰弧线,把长期素材堆成流水账导致单条内容失控,long,制作事件纪实内容的团队,W12.A 人工审表确认
KP-training_unit-humor-content-clothing-as-persona-switch,candidates/domain_general/KP-training_unit-humor-content-clothing-as-persona-switch.yaml,domain_general,"humor_content（幽默内容）中""服装作为人格开关""是服装行业独有钩子——固定机位 + 仅通过加减一件外套 / 背包 / 鞋子 / 眼神 / 站姿，在 2 秒内切换成""顾客面前的自己 / 群里发消息时的自己 / 回家后瘫在椅子上的自己""三个完全不同的人。 没有特效，只要切点准。笑点来自身份落差而非台词，观众接住""我也有这三个自己""。这把幽默从台词笑升级为画面笑， 且服装在此不是美化道具，而",L2,generation,instant,true,1人+手机+200元+4h,low,,只靠一件衣服和站姿切换出三个不同自己,固定机位拍第一个人格状态;用外套背包鞋子快速切换;用眼神和站姿完成笑点,依赖台词和特效制造笑点忽略服装开关作用,short,喜欢身份反差幽默的年轻观众,W12.A 人工审表确认
KP-training_unit-lifestyle-expression-old-defines-premium,candidates/domain_general/KP-training_unit-lifestyle-expression-old-defines-premium.yaml,domain_general,"lifestyle_expression（生活方式表达）的""衣物磨损史""玩法用""旧""反向定义高级——把一件穿了很久的外套摊开， 袖口起球、内衬磨亮、口袋边缘有自己缝的线，手指摸过那些地方，然后穿上它出门做三件小事，每做完一件回桌面 给外套加一处痕迹，最后挂回门口 + 字幕""我喜欢会留下痕迹的东西""。这是极少数能直接引出""耐穿 / 可修补 / 售后 / 环保""卖点而不尬的玩法。配方关键：高级 = 陪",L2,generation,instant,true,1人+手机+200元+4h,low,,用旧衣服的磨损史反向定义真正的高级感,摊开旧衣服拍袖口内衬和修补线;穿着它做三件小事;回桌面再添一处今天痕迹,把高级感拍成崭新精致没有时间和陪伴证据,medium,认同耐穿可修补价值的人群,W12.A 人工审表确认
KP-training_unit-lifestyle-expression-values-via-rejection,candidates/domain_general/KP-training_unit-lifestyle-expression-values-via-rejection.yaml,domain_general,"lifestyle_expression（生活方式表达）的突破性玩法不靠""我怎样生活""的正面陈述，而靠""我今天拒绝了什么""—— 价值观只通过""拒绝动作""出现：拒绝在外面多待一会儿提前回家 / 拒绝外卖哪怕只煮一碗面 / 拒绝为了好看硬穿一双不舒服的鞋。镜头只拍 keys 放回桌上 / 手机扣住转身去厨房 / 镜前换回平底鞋等 具体放下动作，结尾三件物件并排在桌上 + 字幕""我今天决定不去""。这把生",L2,generation,instant,true,1人+手机+200元+4h,low,,价值观不靠宣言而靠今天拒绝了什么出现,拍一个具体拒绝动作;让物件留在桌面形成证据;结尾用三件物件并排收束选择,正面口播我怎样生活导致价值观变成口号,short,喜欢克制生活方式表达的人群,W12.A 人工审表确认
